platform,product,text,date
amazon,Amazon Alexa / Echo,"more than i expected. i use it for timers, alarms, shopping lists, calendar events, news, weather, and so much more.",2026-03-08
amazon,Amazon Alexa / Echo,i really like it works well trivia games and shopping on it is fun.sometimes it misunderstands what i say but other then that the speaker is decent video chat is good but you do need to be in a well lit room so the other end can see you lol.,2026-03-11
amazon,Amazon Alexa / Echo,fun to work with still learning everything she can do,2026-03-15
amazon,Amazon Alexa / Echo,awesome. i love that it shows the lyrics of songs!,2026-03-06
amazon,Amazon Alexa / Echo,love the alarm feature...just tell what time.,2026-03-16
amazon,Amazon Alexa / Echo,i think the dot listens better than spot.,2026-03-05
amazon,Amazon Alexa / Echo,had a dot and upgraded to this! i like it. my only complaint is the very short instructions,2026-03-13
amazon,Amazon Alexa / Echo,"big step up from the dot! dropped one star due to consistent delay in bringing up ring pro video, though looks great once the feed is displayed.",2026-03-05
amazon,Amazon Alexa / Echo,easy set up and to use. i bought two one for my house and one for my 75 year old grandfather. i set it up for him a gave him a 15 minute lesson and he calls me at least once a day it’s is great to be able to see him in between visits.,2026-03-12
amazon,Amazon Alexa / Echo,i wanted to use it as a clock in our bedroom.  but the font is too small to see from any distance.  and apparently you can't change it.,2026-03-07
amazon,Amazon Alexa / Echo,great size for bedside. plus it dims at night!!,2026-03-03
amazon,Amazon Alexa / Echo,"i love it and it works great, the only issue is the “drop in” facetime like feature sometimes lags, but that could possibly be an issue with my wifi for where we have it located in the house.",2026-03-12
amazon,Amazon Alexa / Echo,"love to have meditation music, i use it as a morning alarm, just to mention few in general i love it",2026-03-08
amazon,Amazon Alexa / Echo,"i don't know why i like it, but i do. it's like an all-in-one alarm clock.  if you have other alexa devices, you know what it is.  if you are looking to get an alarm clock, this is the one to get (yes, its much more than that).  it shows you the time, it shows you the weather, its touch screen, it shows you music lyrics, and it does all the things your typical alexa device does.  it's quite loud for its size as well (sound way better than echo dot).  it also does video calling, which is pretty awesome.  the viewing angle is great, so even if its sitting fairly high up, you can still see the display well enough.",2026-03-16
amazon,Amazon Alexa / Echo,quick and easy to set up,2026-03-06
amazon,Amazon Alexa / Echo,i was hoping for a better clock face to make this an alarm clock replacement .  the display brightness dims too much at night to accomplish this task.the display works well for camera viewing.it is an attractive device. and a decent value at $99,2026-03-07
amazon,Amazon Alexa / Echo,i’m a fan of echo devices. i think it’s a great alternative to a clean clock. i like using it to adjust the lightning in the room and listening to sounds to help sleep. my two year old sleeps so much better with it on. we also use it to tell my two year old stories. only issue is the volume of alexa speaking when you tell her to turn off the lights is loud when the volume is set to what you want to listen to the music at night,2026-03-16
amazon,Amazon Alexa / Echo,"i own 5 echo devices, consider me addicted! this little number is awesome, not only do i like that it displays, the sound is great and it has the same dependable functionality as other echo devices. one feature i really like is how it slowly dims after i turn off my bedroom light, so i have a night light for a bit. i love echo devices and have just about run out of places to put them!",2026-03-15
amazon,Amazon Alexa / Echo,i enjoy this little thing a lot.  will do almost anything.  i like the jokes it tells.  i’m still learning different functions,2026-03-10
amazon,Amazon Alexa / Echo,best looking echo device. easy to use,2026-03-04
amazon,Amazon Alexa / Echo,a helpful product with a few glitches eg inability to occasionally access all flash briefing stations and understand or answer certain questions but amazon will likely fix and improve it.,2026-03-06
amazon,Amazon Alexa / Echo,we like it. very convenient,2026-03-04
amazon,Amazon Alexa / Echo,i love the size of the echo spot. it fits on my nightstand but has all of the capabilities of my echo show. i like going to sleep with the lightening storm. the images along with the sounds are very relaxing. the calling and messaging feature is great. it’s small enough to take with when we travel. i love and own most of the alexa products. our whole family uses them.,2026-03-06
amazon,Amazon Alexa / Echo,the amazon alexa is so nice to have she wakes me up in the morning with alarms and is great if you have prime because she can do a lot more plays any songs you want her to play and she can even make playlists of your favorite songs i love the alexa because she has games you can play ad you can watch videos or movie trailers on the screen!,2026-03-15
amazon,Amazon Alexa / Echo,easy to use easy to set up,2026-03-06
amazon,Amazon Alexa / Echo,i love my echo spot that my daughter and son in law got me for my birthday. alexa wakes me each morning and plays music when i ask.,2026-03-14
amazon,Amazon Alexa / Echo,"this product currently has two related software flaws that make it completely unusable:1) there is a &#34;card&#34; on the homescreen called &#34;things to try&#34; -- it's an ad for other alexa services you can try. you can turn off all the other homescreen cards, but not this one.2) by default, the homescreen cards &#34;cycle&#34; automatically, which is incredibly annoying. there is a setting where you can opt to have the cards only &#34;cycle once&#34; instead of &#34;cycle continuously&#34;, but critically *this setting does not work*. my unit has been set to &#34;cycle once&#34;, and the cards still continue to cycle all the time. have rebooted the device, re-set, etc etc.until these two obvious software issues are fixed, in my opinion the product is useless.",2026-03-07
amazon,Amazon Alexa / Echo,great deal on prime day,2026-03-10
amazon,Amazon Alexa / Echo,excelente su funcionamiento y llama la atención la rapidez de respuesta y el control que se logra a través de la utilización con alexa. me sorprendió gratamente. muy recomendable.,2026-03-11
amazon,Amazon Alexa / Echo,"purchased this on prime day and i absolutely love it!  i had the echo dot on my nightstand, but i really missed a display. this is perfect and the speakers are excellent.",2026-03-09
amazon,Amazon Alexa / Echo,"yes it met my expectations.  the snooze on the alarm needs a but of work.  tap it and it snoozes, swipe up and it prompts you to dismiss.  but without my glasses i can't read it and often it just snoozes.  then one day i must have dismissed tomorrow's alarm because it never went off.  i have it set for mon-thu.  fri i don't need to get up early.  a more apparent indicator of the alarm set would be nice.  my old alarm had a red light.",2026-03-06
amazon,Amazon Alexa / Echo,"great product, and i like the screen for a alarm clock",2026-03-16
amazon,Amazon Alexa / Echo,"such a fun, easy, and convenient device to have around the house. no need to pick up my phone to look something up, just a few words and the world is at your fingertips. the speaker puts off great sound and the screen is crisp. the price is right for a device like this.",2026-03-02
amazon,Amazon Alexa / Echo,"a great replacement for the bedside alarm clock, which had a funny habit of going off at 12am every time the cleaning ladies came through. we mostly use it to turn the ceiling fan lights on and off, while leaving the fan running. only gripe would be the mic sensitivity, which doesn't appear be as good as the view or gen2. it can get a little frustrating having to repeat yourself.",2026-03-16
amazon,Amazon Alexa / Echo,this product has made my life much simpler with a little one. i use it a lot for music and when i have my hands full turning it on/off or up/down is a breeze. the screen is a great novelty where i can watch the news!,2026-03-13
amazon,Amazon Alexa / Echo,works well and was easy to set up.,2026-03-08
amazon,Amazon Alexa / Echo,"love my spot, it now acts as my new alarm.",2026-03-05
amazon,Amazon Alexa / Echo,this is the one of my favorite amazon devices.  have one in my bedroom and use as alarm clock. perfect addition to our home of alexa devices.,2026-03-12
amazon,Amazon Alexa / Echo,"wasn't so sure about bringing &#34;smart technology&#34; into my home, but i'm hooked! i love the sleek look of the echo spot on my nightstand and how easy it was to set up and use. i also love that it scrolls the news, local weather, and give suggestions of what to ask alexa. i use this as my alarm clock, speaker, and have it sync'd with the etekcity voltson wi-fi smart plugs to control the lighting in my apartment.",2026-03-12
amazon,Amazon Alexa / Echo,you need a harvard law degree to operate this thing! it's going back very soon!,2026-03-04
amazon,Amazon Alexa / Echo,love it getting use to it and alexa is getting use to my voice . sometimes she doesn't answer but i think it has to do when internet is low or is updating or my voice isn't strong. over all i haven't had any of the annoying stuff that everyone is complaining about. thank goodness i didn't listen to those reviews.  and paid attention to the apple guy .,2026-03-11
amazon,Amazon Alexa / Echo,product turns on randomly and sometimes at night,2026-03-11
amazon,Amazon Alexa / Echo,i used it as an alarm clock  i lov it,2026-03-16
amazon,Amazon Alexa / Echo,it was much smaller than i was expecting for the cost.,2026-03-08
amazon,Amazon Alexa / Echo,alexa wakes me up everyday for work to whatever station on iheart radio or spotify i want. plus when i do get smart home devices she’ll be even more useful to me! she’s really helpful with answering random questions. the small screen sucks for video as it is small and round but it’s nice to have something to show time and pictures.,2026-03-15
amazon,Amazon Alexa / Echo,fun so far...still learning how it all works,2026-03-08
amazon,Amazon Alexa / Echo,"i purchased this on prime day mostly as a present for myself because i found having the echo plus on my kitchen counter to be overwhelming when cooking, cutting, cleaning, etc. especially when our counters aren’t very wide to begin with. after going back and forth between this and the show i decided on this because i felt it had all the same features but is more compact. i can honestly say i have no regrets. while i probably wouldn’t watch a movie i’d been dying to see on this, it’s a great way to listen to music, watch a quick youtube video, etc. i even attempted watching “jaws” on this and while it wasn’t the most comfortable thing for my eyes to do, it wasn’t as bad as one would think. i would definitely recommend!",2026-03-08
amazon,Amazon Alexa / Echo,we love the echo spot i use it on my nightstand for alarm clock and play iheartradio radio while getting dressed!!,2026-03-14
amazon,Amazon Alexa / Echo,it was easy set up.  i use it more than i thought.,2026-03-08
amazon,Amazon Alexa / Echo,i would love this but there is no way to stop the screen from constantly scrolling through “things to try”. if amazon would make this a setting i would change my review to 5 stars.,2026-03-03
amazon,Amazon Alexa / Echo,"i am a small business owner with no staff. with the alexa driven echo spot, i feel like i've hired my first assistant! my echo spot keeps me organized, updated, and assistance when i need information that will help my day run more smoothly. i love my echo spot so much, i bought 2 more for my kids who love their echo spot too! i highly recommend this product.suggested improvement for future versions, make the echo spot wireless. 😊",2026-03-03
amazon,Amazon Alexa / Echo,"bedroom clock , ask questions,  weather reportsalarm clock ⏰. music 🎶 download music",2026-03-11
amazon,Amazon Alexa / Echo,speakers are not as loud as google home,2026-03-09
amazon,Amazon Alexa / Echo,i haven't figured out how to make or receive calls.  device tells me i need to register and i do not know what to do.,2026-03-06
amazon,Amazon Alexa / Echo,"i need to get some better controls for custom displays and the ability to make my own clock, but that's asking a lot. in general, great device; glad i got it.",2026-03-02
amazon,Amazon Alexa / Echo,"gave it my daughter for her birthday, she loves it! sound is amazing, she plays music on it constantly. worth every penny. this is the third amazon device purchased, we have 2 echo shows and now the spot.",2026-03-02
amazon,Amazon Alexa / Echo,"i use the product as an alarm clock. i love being able to set my schedule for the week and not worry about it. when images are shown, they are cut off. little because its trying to fit it into a circle.",2026-03-07
amazon,Amazon Alexa / Echo,love the ease of use and convenience the echo spot has offered,2026-03-06
amazon,Amazon Alexa / Echo,"great product and i would give 5 stars - but you can't scroll face cards without having the stupid &#34;try and ask alexa&#34; suggestions pop up.  yes you can have it scroll once, and just stay on the clock, but i like having other cards as well. god its the worst and so irritating.  i got it super cheap, so i just face the screen toward the wall and treat it like a dot instead of a spot.  what a dumb move on amazons​ part.",2026-03-05
amazon,Amazon Alexa / Echo,"love that i have command access to news such as bloomberg tv, npr, etc.highly recommend that you gain access to alexa app before setting up device and get familiar with key features/services...such as setting up your daily commute.if family and friends have spot...then it’s a great substitute for skype and face time...you can always “drop in” when missing loved ones or just to catch up.",2026-03-07
amazon,Amazon Alexa / Echo,good size screen and gets good range for voice commands. sometimes it picks up weird commands when i'm watching tv though. great product for the price if you don't need the big show screen.,2026-03-06
amazon,Amazon Alexa / Echo,"it is a good addition to my small space, and it keeps me up to date on events and weather conditions.",2026-03-12
amazon,Amazon Alexa / Echo,best thing i have ever owned! started with the dot and now added the spot and i love iy,2026-03-08
amazon,Amazon Alexa / Echo,i love it the coolest thing since sliced bread,2026-03-10
amazon,Amazon Alexa / Echo,"this product is a complete waste of money. when you ask alexa a question ""she"" either doesn't know the answer, gives you the wrong answer or finds information off of wikipedia!",2026-03-15
amazon,Amazon Alexa / Echo,"honestly it's no different from the echo dots i already own,  other then occasionally seeing the lyrics to a song i'm listening too i really don't see the difference.",2026-03-09
amazon,Amazon Alexa / Echo,"i got this for my husband on prime day. he loves it as his alarm clock and smart device. this is our 3rd echo device, and we have them all connected throughout the house. although you can deactivate the camera, we also chose to cover it since the device is in our bedroom. i'm not comfortable with having a camera in the room (no, we don't bring our cell phones in the room).",2026-03-10
amazon,Amazon Alexa / Echo,"great product, what they don't tell you is that once you allow a &#34;drop in&#34;  they can drop in anytime!!!  while they are sleeping, while we are yelling at them, while anything.",2026-03-13
amazon,Amazon Alexa / Echo,"i have two. one in my computer room and the other that i move around out on the deck. not great for watching video, but it can be done. with the added sound you don't get from the echo dot, it is perfect for the location i have it in. add whole house music, and you have just arrived in nervana.",2026-03-01
amazon,Amazon Alexa / Echo,surprisingly handy. wish it had more options geared towards it being on your nigh stand. like an even dimmer setting.,2026-03-09
amazon,Amazon Alexa / Echo,"i was on beta list for alexa, have a show, an original alexa, 4 echo's and i actually like this the best, even more than show",2026-03-01
amazon,Amazon Alexa / Echo,"i was contacted by people in india. were they suppose to charge me $79.00? it was very hard to understand their instructions. they did have control of my computer and network. i, also, bought a cloud cam but do not know how to make it work with alexa.",2026-03-08
amazon,Amazon Alexa / Echo,"i have the dot and echo plus, this one can't seem to &#34;hear&#34; me as well and doesn't do as much as i expected.",2026-03-07
amazon,Amazon Alexa / Echo,bought this for our son as his birthday present and he loves it.  often find him jamming to music in his room now  :)  he loves the options for the alarms and we have his weekday alarms set to repeat and he gets to sleep in on non-school days.,2026-03-01
amazon,Amazon Alexa / Echo,"what a great little gadget for the house. you ask and it delivers, period. well done!",2026-03-09
amazon,Amazon Alexa / Echo,"i switched to google. the amazon helper is more for shopping, and google is the tasks assistant.",2026-03-09
amazon,Amazon Alexa / Echo,my favorite echo. a more than adequate replacement for a clock radio.,2026-03-08
amazon,Amazon Alexa / Echo,"the echo spot is compact, nice sound and camera quality. makes it great to video chat with the family when i'm travelling for work. ease of use that the youngest member (10 years) has no problem talking to mama on the video chat and understands the important of digital security.",2026-03-13
amazon,Amazon Alexa / Echo,this echo spot is great i love it,2026-03-15
amazon,Amazon Alexa / Echo,"the voice recognition is amazing, perfect companion for the bedroom.",2026-03-09
amazon,Amazon Alexa / Echo,"i liked it, perfect size, the screen is really clear,  and elegant.",2026-03-11
amazon,Amazon Alexa / Echo,"i am not easily impressed with electronic goodies. but...omg this is by far the coolest thing i have ever had.  it does everything short of clean your house... which, when i asked alexa to clean my house.... was told she didn’t have hands, but instead played a fantastic playlist for cleaning!  from reading books to my five year old, to video chat, to silly selfies, music that automatically goes to my bose bluetooth speaker, setting timers, alarms, changing my thermostat on voice command, tells me the weather, sends hubby a grocery pick up list, and i am sure. million more things!buy it.....you u will not regret it.",2026-03-02
amazon,Amazon Alexa / Echo,"this product is beautifully designed and i no longer have to hide an echo device away like i did with dot. it would be nice if amazon would lose that camera though, which i have not used and might cause squirms for the privacy conscious.",2026-03-04
amazon,Amazon Alexa / Echo,love this little dot with a screen.  super easy to set up and easy to use.  instantly connected to all my other echo products.  i also bought the screen cover that has the blocking button for the camera if you want to use it.  recommended.,2026-03-07
amazon,Amazon Alexa / Echo,alexa is not as smart as siri! cannot cancel snooze after alarm goes off. have to cancel pre-set alarm for weekdays.,2026-03-08
amazon,Amazon Alexa / Echo,"great product except there is no possible way for it to act as a clock the displays the time permanently.  when in 'clock' mode, the screen rotates between the clock face and a 'things to try' screen.  i intended on buying several units for my house, but i do not need a screen in the house that is permanently trying to upset me.  acting as clock should be a basic feature of the echo spot.  how could you get this wrong, amazon??  #fail",2026-03-13
amazon,Amazon Alexa / Echo,"i wanted to use this as a bedside clock with the ability to play music and podcasts. sadly, it continuously scrolls the &#34;things to try&#34; and won't stay on the clock face. amazon is about to get this one back.",2026-03-05
amazon,Amazon Alexa / Echo,hands free calling in the house. i misplace my cell phone all the time so this is a real blessing. really enjoying the streaming music.,2026-03-09
amazon,Amazon Alexa / Echo,"got for elderly parents,easy for them to use.just instructions could be more informative",2026-03-11
amazon,Amazon Alexa / Echo,this thing is great. fantastic alarm clock.,2026-03-05
amazon,Amazon Alexa / Echo,"we love using it for bedtime reading on audible. it's very kid-friendly, and i can see liking it in the kitchen while i'm cooking since it's small and unobtrusive. we like it better than our echo dot.",2026-03-04
amazon,Amazon Alexa / Echo,very nice gadget. love it's look.,2026-03-01
amazon,Amazon Alexa / Echo,not happy with the spot.  reset numerous times.  seems to be in slow mode.  have to be practically on top of it for it to hear me.  even after talking with support i still do not have “themes” in the menu to choose from!,2026-03-13
amazon,Amazon Alexa / Echo,love the spot - awesome little guy with precise video - i’m saving to buy one for my mom on the east coast - the spot changes everything as far as keeping your loved ones connected!!!well worth every cent!!,2026-03-10
amazon,Amazon Alexa / Echo,"all is fine with the spot exact for one massive failing.  in order to turn off a repeating alarm in the morning you pretty much have to talk - which is not a thing you usually want to do when first woken up and your bed partner will definitely not like.  yes, you can manually swipe up on the alarm face to dismiss but i) swiping up rather than touching screen when you are half asleep is very difficult and results in setting snooze more than half the time even if you really try to swipe to dismiss and ii) if you do manage to swipe up to dismiss, then you completely delete your recurring alarm.this is especially annoying as amazon could so easily fix this by simply making touching the screen turn off the alarm but not delete it or at least make it a setting to decide whether touching the screen for a recurring alarm snoozes or turns it off.  but as the clock has been out for a year now and they still haven't adding this setting, clearly not going to happen.  this may be the biggest product design screw up amazon has ever made.",2026-03-12
amazon,Amazon Alexa / Echo,"item returned for repair ,receivded item back from repair 07/23/18 . parts missing no power cord included.please advise",2026-03-06
amazon,Amazon Alexa / Echo,awesome item that i had to buy two!,2026-03-06
amazon,Amazon Alexa / Echo,"for as awesome as the echo and echo dots are, the spot is a disappointment. there is very little control over what the screen shows, what the clock looks like, what order things show up in, etc. at this point if i hadn't thrown the box away immediately, i would have sent it back and just got another full size echo.",2026-03-05
amazon,Amazon Alexa / Echo,it has replaced my clock and google mini on my nightstand.  outstanding little device.  i hope an update will give a simple face and font color options for the clock.,2026-03-09
amazon,Amazon Alexa / Echo,i love the echo spot!,2026-03-10
amazon,Amazon Alexa / Echo,it every ting i thought it would be plus more.  this will be going to my mom right after i get through playing with it.,2026-03-12
amazon,Amazon Alexa / Echo,the most fascinating thing i've ever bought,2026-03-08
amazon,Amazon Alexa / Echo,"sound quality is less than a dot, microphones don't pick me up as well as the other models (i have echo and dots).  picture quality is good",2026-03-01
amazon,Amazon Alexa / Echo,awesome cute and smart!,2026-03-11
amazon,Amazon Alexa / Echo,product forces user to review alexa things to try. there is no way to disable it.,2026-03-04
amazon,Amazon Alexa / Echo,"absolutely love it. after much persuasion from a friend, i finally gave in and bought one. let's just say that the moment alexa enters my life, i turn around and tell siri to get the hell out.",2026-03-11
amazon,Amazon Alexa / Echo,"this is my first alexa device and it is so fun to discover all of the ways to use it. the biggest con with me is the ""drop-in"" feature, it's pretty creepy",2026-03-07
amazon,Amazon Alexa / Echo,the best thing since sliced bread!,2026-03-09
amazon,Amazon Alexa / Echo,"can’t be used as a baby monitor which is why i had purchased it.  i didn’t realize this until i read the reviews on the alexa skill for syncing the nest cam.  considering all of the poor reviews and the fact that it should be simple to fix, surprised amazon hasn’t upgraded the software to allow more than 39 minutes of viewing or alerts like you get on the nest app.",2026-03-02
amazon,Amazon Alexa / Echo,"would be 5 stars if you could turn off the &#34;things to try&#34; screen!!!  i should have read up on this before buying the spot.  amazon, please update to enable us to turn this off!  it is so extremely annoying to look over to see the time but instead see &#34;things to try&#34;.",2026-03-09
amazon,Amazon Alexa / Echo,love it. so great to use!!!,2026-03-16
amazon,Amazon Alexa / Echo,"i own 3 of these...  amazon is ignoring its customers and using these devices as a marketing tool.  you can customize the screen contents, but you cannot turn off there advertising, things to try...  people will suggest that you can, but you can only do so if you turn off all content changes which is not an acceptable option.moreover, they should increase the size slightly, and improve the audio speaker.  that would give you a 5 star device.right now i’m debating whether to return all 3 devices.  my wife says we should.",2026-03-16
