platform,product,text,date
amazon,Amazon Alexa / Echo,"i decided to buy smart door lock and decided on getting the echo plus to control it.  i chose a kwikset 888 because amazon said it was compatible and i bought 2 dots while i was at it.  and when i posed the question, somebody in the community said it will work with alexa.  what i didn't know was the z-wave lock and zigbee alexa hub weren't compatible.  does any body know of a lock that works seamlessly with echo plus?  if not, i guess my choices are: 1. exchange the plus for a regular echo and buy a separate hub like wink.  2. return the whole alexa system and get something else.i  don't want to just buy another hub to use along side my echo plus or i'll be back here asking how to integrate two hubs.the reason i kept from buying smart systems up to this point  is because i was afraid they wouldn't operate seamlessly and unfortunately i only do enough research after something doesn't work.",2026-03-02
amazon,Amazon Alexa / Echo,this echo plus has proved to be the most innovative improvement in my life!,2026-03-09
amazon,Amazon Alexa / Echo,"i purchased the amazon echo plus on amazon prime day because i need a hub. i'm in the process of upgrading my home into a smart home. for the same price as some hub's, and even less expensive in some other cases. i got a hub that works with my devices, plus it does a lot more. i haven't even had time to go through all the skills it has, but i've already found myself using many of them. when i started a search for a hub. i wasn't even considering the echo. in part, because i didn't know it was a hub. but also because i didn't really think i would find much use for another ai system. if you're looking for a hub. why settle for a plane hub, when you can get a personal assistant that does so much more and yet cost's the same or less than other hubs? oh! and by the way. for the same price as the amazon echo plus alone. i found one that came bundled with a smart bulb & saw another that came with a smart plug. given the price of these extras. well, that just put the echo plus over the top.",2026-03-10
amazon,Amazon Alexa / Echo,"i'm so happy that i purchased alexa.  when i recently saw this at a friend's home, he played some music while talking about the product.  i love the sound & love that all i have to do is tell alexa or ask a question & she responds immediately.  i haven't been able to listen to my cd's for a while since i have a problem within my stereo equipment for some time now so this makes me extremely happy that it's not an issue any longer.",2026-03-05
amazon,Amazon Alexa / Echo,"after we learned to use this (we are still learning), we are very pleased with echo plus",2026-03-01
amazon,Amazon Alexa / Echo,i love it !! used one like this in philly while visiting my son and decided to buy my own on prime day !,2026-03-08
amazon,Amazon Alexa / Echo,the speakers on these devices are surprisingly good. the functionality of each echo device is fantastic.,2026-03-10
amazon,Amazon Alexa / Echo,as advertised.  connected my smart bulbs with no problems.,2026-03-10
amazon,Amazon Alexa / Echo,"love warehouse buys. if this was just in good used condition, then new must be newer than new. seriously, this one was perfect, not a mark on it anywhere. great buy!",2026-03-04
amazon,Amazon Alexa / Echo,alexa is awesome! the first day i got my echo plus i found out things that she can do that i didn’t think were even possible. i highly recommend this product. along with all the accessories.,2026-03-13
amazon,Amazon Alexa / Echo,ease of set up. i’ll have fun sitting up other features as well as making my house a smart home.,2026-03-16
amazon,Amazon Alexa / Echo,i try use with yale lock but isn’t work,2026-03-15
amazon,Amazon Alexa / Echo,it seems to be ok but the instructions are weak and i can not seem to get it to work. i am going to get my techy friend to help me out and i will update you later,2026-03-05
amazon,Amazon Alexa / Echo,"i love everything about it. i love that the echo plus turns on and off my light. it can also dim them with voice commands. i also like listening to my kindle books even the ones that i didn’t purchased  audibles for. i like that it can play my music from amazon music, pandora, tunein, i heart radio and spotify. echo can even play my local radio station. i love that the echo is connected to my tivo bolt. this allows tivo to pause, stop and play whatever i want with a simple voice command. i love that i can reorder items that i purchased on amazon and that the echo plus notifies me when my order is mailed, when it will be delivered and when the package has been delivered.  the only three dislikes that i have is that if you’re up too close or to far the echo doesn’t respond. so i think they need to improve the microphone. and i wish the speaker was better. the speakers are okay but could be improved. also i have the echo dot and it never has given me any problems with the internet. well the other day i received a red light right on my echo plus. this error was sorry i’m having trouble understanding you please try again later. after research online i learned it was a problem connecting to my internet. and it was easy to find this out. and i found it odd that my dot wasn’t having this problem even though they are connected to the same network.",2026-03-06
amazon,Amazon Alexa / Echo,love everything about this....,2026-03-11
amazon,Amazon Alexa / Echo,perfect for controlling my tp-link smart devises,2026-03-12
amazon,Amazon Alexa / Echo,love this thing. easy to setup and  looking forward to adding more smart devices to my home.,2026-03-12
amazon,Amazon Alexa / Echo,got it specifically to work with the august smart lock and it connected to it with ease.  definitely ties the smart home together.,2026-03-11
amazon,Amazon Alexa / Echo,sound very nice perfect for the price,2026-03-16
amazon,Amazon Alexa / Echo,love it it's number 4!,2026-03-09
amazon,Amazon Alexa / Echo,wonderful product.  love alexia,2026-03-05
amazon,Amazon Alexa / Echo,it has a nice speaker.,2026-03-10
amazon,Amazon Alexa / Echo,music mainly but still checking other features,2026-03-01
amazon,Amazon Alexa / Echo,"very capable.  language recognition is the best i've experienced.  great sound, too!",2026-03-12
amazon,Amazon Alexa / Echo,love .. love my echo plus !  so silly simple to set up .  alexa has now become my new bff.  amazon 24/7 support is hard to beat !!  any questions answered any time ... what more can you ask for !!!,2026-03-01
amazon,Amazon Alexa / Echo,its got to be one of the coolest things.,2026-03-03
amazon,Amazon Alexa / Echo,awesome! easy set up. linked right up with my nexia home automation.,2026-03-06
amazon,Amazon Alexa / Echo,hands free voice commands and interactions with smart devices around the house makes having an echo plus one of the best purchases i’ve made!,2026-03-01
amazon,Amazon Alexa / Echo,definitely a really good buy for first time buyers of smart home stuff =]i bought 3 =],2026-03-03
amazon,Amazon Alexa / Echo,i enjoy the various functions of the device,2026-03-03
amazon,Amazon Alexa / Echo,"alread had echos and dots, but the ability to control philips hue bulbs nudged me to buy this on prime day.  another fun product from amazon.",2026-03-15
amazon,Amazon Alexa / Echo,"i purchased the echo plus with the build-in hub, so i could have the convenience of asking alexa to turn my lights and lamps on and off.  philips hue light bulbs were placed in the fixtures that i wanted alexa to control and they all work great!  i already had an echo dot in my kitchen/den area, so i placed the echo plus with hub in my bedroom. my radio and lamps in my kitchen and den are controlled with tp-link plugs.  but, the ceiling light fixtures and lamp in my den and bedroom have special philips hue light bulbs that are controlled by the hub inside the echo plus.  i am able to play music, set my alarm, get weather reports and numerous other things on both devices.  the echo dot requires a tp-link plug to be plugged into it and the echo plus requires a special philips light bulbs installed in each light fixture to work..  the only thing i dislike is the high price of the light bulbs required to make the lights work. regular light bulbs placed in the ceiling light fixtures will not work with alexa and  the echo plus with hub.  other than the high price of the bulbs, i love my echo plus with built in hub!",2026-03-08
amazon,Amazon Alexa / Echo,easily configured hub capabilities.  excellent sound quality for the size of the unit.,2026-03-07
amazon,Amazon Alexa / Echo,works great in my large open room,2026-03-05
amazon,Amazon Alexa / Echo,this is outstanding works awesome the music sound very clear and loud and alexa is very smart,2026-03-07
amazon,Amazon Alexa / Echo,i bought this specifically for the smart hub capability. so far it has been great. easy set up instructions for all the various brands compatible with it.,2026-03-12
amazon,Amazon Alexa / Echo,"the sound is wonderful and it just plain works. i wish it cost less, but it is worth the cost. (especially on prime day)",2026-03-13
amazon,Amazon Alexa / Echo,comes with a hub.  got it during prime day for $99 and a hue white bulb.  works great.  now i can add more stuff that required a hub!,2026-03-04
amazon,Amazon Alexa / Echo,"got it for the smart hub and does exactly was it says, turn lights on and off, arm and disarm my security system and the thermostat is next.  great.product!",2026-03-01
amazon,Amazon Alexa / Echo,"very easy to set up, great sound.",2026-03-13
amazon,Amazon Alexa / Echo,so far it's been very useful. trying to learn all the ways to use alexa .,2026-03-05
amazon,Amazon Alexa / Echo,works better than i thought,2026-03-12
amazon,Amazon Alexa / Echo,"loved all about it, all i can do with it and it looks good.",2026-03-15
amazon,Amazon Alexa / Echo,great product and fast shipping. thank you,2026-03-16
amazon,Amazon Alexa / Echo,"it's fun to imagine the household management options ...some info questions baffle alexa, but other options are cool - esp. music-related ...",2026-03-07
amazon,Amazon Alexa / Echo,easy to set up and works like it's supposed to.,2026-03-03
amazon,Amazon Alexa / Echo,"love it, very easy to set up.love that you can request just about anything on your mind and it works on giving you useful information.",2026-03-07
amazon,Amazon Alexa / Echo,great product. more skills are needed. i love it.,2026-03-16
amazon,Amazon Alexa / Echo,my first smart buy..i am loving it and all the great things alexa can do.,2026-03-11
amazon,Amazon Alexa / Echo,"this thing is awesome!  i got it on prime day for a great deal.  i wish i had purchased two.  i also bought the echo show version, but the sound is not nearly as good as the echo plus.  the echo show came dented, so i will be exchanging it.  i like the screen and many of the features so i will not be getting a refund.  it was still worth the price.",2026-03-15
amazon,Amazon Alexa / Echo,is great having a new friend,2026-03-08
amazon,Amazon Alexa / Echo,coop product many uses including smart devices throughout the home,2026-03-16
amazon,Amazon Alexa / Echo,"easy setup with great sound, i would rate this unit a 10 +++++, and a must have for the office and home. l am looking add other devices (locks, and lights) for my home.",2026-03-12
amazon,Amazon Alexa / Echo,better than expected!,2026-03-10
amazon,Amazon Alexa / Echo,"wonderful, still learning how to use. had a heck of a time setting it up, but is happened somehow.",2026-03-01
amazon,Amazon Alexa / Echo,it's fantastic. very happy with the purchase.,2026-03-12
amazon,Amazon Alexa / Echo,i like the list ability and the music i can play.  i do not like that i can not create a playlist without using the app and even then alexa will not play my songs i have to do it through my tablet or phone.  i also do not like that alex can not print again it has to be done through the app.,2026-03-02
amazon,Amazon Alexa / Echo,"it is a great bundle of fun. music ,games, questions etc. i luv it turns off my smart lights. i purchase 4 more smart light for my lamps in the living room and my room!",2026-03-02
amazon,Amazon Alexa / Echo,first time using alexa and so far i love it.,2026-03-13
amazon,Amazon Alexa / Echo,"it was a little hard to follow their instructions, great product",2026-03-01
amazon,Amazon Alexa / Echo,"this was a replacement. it was really easy to set up. i had to reauthorize my smart items to work with the new hub, but installation was easy and instructions were clear.",2026-03-06
amazon,Amazon Alexa / Echo,really cool device that does a ton of stuff. fun games like jeopardy. we used this to set up smart bulbs and light switches. make sure you ge the stuff that corresponds with this particular hub. had to make a few runs back to the store for exchanges.,2026-03-07
amazon,Amazon Alexa / Echo,"i’ve been waiting for prime day to purchase an echo plus and now, i’m enjoying learning what alexa can do. with a new sonos one and an echo dot, i have the makings of a really nice and well-integrated smart home. love it!",2026-03-15
amazon,Amazon Alexa / Echo,"i haven't had it very long, but so far our whole family is enjoying asking alexa questions!",2026-03-06
amazon,Amazon Alexa / Echo,"although this is my second echo device, i am still very disappointed that there is almost no documentation/instructions as to the many functions of the device.  i purchased becausse of the sound quality, but only found out it has bluetooth capabilities last night by accident.  there needs to be a manual that details all of the functionality of the device.  or at least point out where it can be found...",2026-03-10
amazon,Amazon Alexa / Echo,"the echoplus is a great extension for the echo dots in our home. i am a little disappointed that alexa is not as good at information requests as google. but as a start on home automation, she is very impressive.",2026-03-10
amazon,Amazon Alexa / Echo,i never had alexa before but the biggest reason i bought it was for youtube and apparently youtube stopped supporting it and that is why it will get 4 stars.... it's mostly youtube's fault but i worked around it by using my cell phone as a blue tooth connected to hear things but still takes the voice activate purpose away but the speaker is amazing to hear my youtube watch later playlist,2026-03-16
amazon,Amazon Alexa / Echo,awesome!! loving alexa,2026-03-02
amazon,Amazon Alexa / Echo,love the music the stories,2026-03-16
amazon,Amazon Alexa / Echo,like it but it will take time to setup all the skills i want simply because there are so many. i already use music and flash briefing daily. very satisfied. i use this along with alexa app on my kindle hd8,2026-03-04
amazon,Amazon Alexa / Echo,"wish it would have came with the lightbulb, but otherwise works great, fast delivery, and i enjoy using it!",2026-03-09
amazon,Amazon Alexa / Echo,"still haven’t learn all the echo can do, but so far, quite pleased!",2026-03-06
amazon,Amazon Alexa / Echo,i can receive my cpr classical station.  great sound.what i like least is the learning curve and my mistakes.,2026-03-04
amazon,Amazon Alexa / Echo,"sounds well and we find it useful overall but it can be frustrating when it doesn’t respond or you forget the correct command.  “alexa, turn on the living room lights”.  oops i mean “alexa turn on the family room lights”. i also never realized i call my couch a sofa some times.  unfortunately my alexa is confused by my changing names for where i sit.",2026-03-01
amazon,Amazon Alexa / Echo,no it is broke and i can't get help fixing or replacing it,2026-03-08
amazon,Amazon Alexa / Echo,"i’m still unable to connect any devices although it says it has a built in hub. so bought a bridge to connect the devices thinking that everything would sync and my other devices are still not discovered via my echo plus and i was looking forward to this feature. being able to play music, check the weather etc is fine.",2026-03-02
amazon,Amazon Alexa / Echo,sounds great have not used the hub yet,2026-03-15
amazon,Amazon Alexa / Echo,"is as expected and more, responds very fast to given commands and was very easy to connect via the amazon app. i also bought the philipshue light bulb and all i had to do was put it in my lamp and tell alexa to find my device and it connected and the lamp now turns on and off with voice commands.",2026-03-01
amazon,Amazon Alexa / Echo,it is as if we are having a conversation with another person.  instantaneous response.  and the fact that it catches your command even when you're far from it is simply just amazing.,2026-03-16
amazon,Amazon Alexa / Echo,although i haven't taken advantage of many of the echo's features there is one that bothers me. it starts talking even when i haven't said anything even close to the wake up word - echo - had to change from alexa due to a conflict with another device.,2026-03-15
amazon,Amazon Alexa / Echo,the echo plus is very straight forward and easy to use.  it plays great sounding music and can do lots of other things.  still learning what all it can do.  working very well so far.,2026-03-13
amazon,Amazon Alexa / Echo,we have used for last 2 weeks. we like it. my children also like it. alexa has become part of our family.,2026-03-12
amazon,Amazon Alexa / Echo,terrible. stopped working after one day.,2026-03-11
amazon,Amazon Alexa / Echo,"better sound than my echo dot. simple to set up, less than 5 minutes.",2026-03-08
amazon,Amazon Alexa / Echo,nice toy to have around!,2026-03-13
amazon,Amazon Alexa / Echo,"it does not speak in spanish,,,i bought it for my grandmother to have someone to talk to when i’m not around,,,,,no spanish!",2026-03-11
amazon,Amazon Alexa / Echo,love all the cool thing i can do!,2026-03-15
amazon,Amazon Alexa / Echo,like it. still working discovery. really too soon to fully evaluate. but looking forward to learning and using it.,2026-03-02
amazon,Amazon Alexa / Echo,"when i got this echo i was excited to have a device with better sound than my dot and a hub to control some hue bulbs.what i didn't realize and also wasn't fully communicated to me, is that you can't use hue bulbs to their full potential with this device. you can only turn on and off the lights and set them to a number of preset colors. you also cannot update the bulbs to the newest firmare which is a security concern for me.do not buy this if you want a full featured hub for your new iot devices. if you do, you will end up needing to update to a standalone hub, which makes the hub inside this device redundant and pointless.i still love the echo and have zero complaints about the alexa functionality or sound quality of this device. i'm only disappointed with the hub's functionalities.",2026-03-15
amazon,Amazon Alexa / Echo,still needs some work on commands. sound is equal in the regular echo so if you don't need a smart hub get a regular echo. the sound is ok with it had as much bass as my old soundlink but i mean hey gets loud on the treble and sounds clear.,2026-03-08
amazon,Amazon Alexa / Echo,"i love my echo plus. i use it with my spotify account, to find my phone, make phone calls,  turn our lights off and on, much more. most importantly it reads story to my children.  they love it and that makes me happy.",2026-03-02
amazon,Amazon Alexa / Echo,excellent why didn’t i think it is in the beginning i love it,2026-03-11
amazon,Amazon Alexa / Echo,"bye bye philips hub and expensive monthly internet charge!  took a little tinkering, had to rest the individual bulbs, but works great! no more, &#34;philips hue bridge is not responding&#34; message.",2026-03-14
amazon,Amazon Alexa / Echo,"works great! exactly as described. only complaint i have is sometimes alexa gets confused with smart home product names and i had to go back and change some stuff around, but i chalk that up to my inexperience with smart home stuff.",2026-03-13
amazon,Amazon Alexa / Echo,i love it. use it mostly for the music huge repertoire to choose from,2026-03-14
amazon,Amazon Alexa / Echo,very easy to hook up. download the app and it walks you through the setup,2026-03-11
amazon,Amazon Alexa / Echo,"i am so disappointed in this product.  i tried to install two different units and neither one of them were successfully completed.  hours with amazon technicians.. resetting each of them.  the app didn't connect the echo plus to the internet connection.  tried using the application on a phone, a tablet and on a chromebook... no luck.  there are no clean directions on the application.  probably sending this back to amazon..mark this as not ready for prime time.",2026-03-09
amazon,Amazon Alexa / Echo,well behaved device that i enjoy using.,2026-03-07
amazon,Amazon Alexa / Echo,easy setup and sound quality.,2026-03-05
amazon,Amazon Alexa / Echo,i really love the hub feature,2026-03-04
amazon,Amazon Alexa / Echo,what a blast!  we love echo...  just learning all the tricks but lots of fun and helpful too!,2026-03-16
amazon,Amazon Alexa / Echo,"great sound quality, works well with smart home devices",2026-03-02
amazon,Amazon Alexa / Echo,use way more often than we used our google home.,2026-03-15
amazon,Amazon Alexa / Echo,"mic hears everything but only understands about half the first time, it often takes multiple tries until it gives the correct result.",2026-03-06
amazon,Amazon Alexa / Echo,"nice add on to a home.what i don't like are the limitations, for example world soccer. it won't give you much info of sport teams other than american.",2026-03-10
amazon,Amazon Alexa / Echo,"i was a little apprehensive about buying this because i saw reviews saying it sounds like crap. i'm no audiophile by any means so maybe it's that, but i think it sounds great considering the size. it fills my living room with sound and gets pretty loud while remaining clear. i haven't had any issues pairing with my devices or utilizing any of the voice commands. i have it paired to an ecobee3, my firestick, and a phillip's hue light bulb. i plan on adding devices as i go. i love this thing and i'm glad i scooped it up! i have only had it around 2 weeks. will update if i run into issues.",2026-03-16
amazon,Amazon Alexa / Echo,i love my echo plus. the only drawback is that there is no battery so it has to be plugged in at all times which makes it inconvenient  to use outdoors.,2026-03-02
amazon,Amazon Alexa / Echo,"great device, my grandkids had a ball setting it up for me!",2026-03-16
amazon,Amazon Alexa / Echo,the alexa is awesome but when i rcieved the light buld i did not know that u need another adapter to have the light buld to work. i was not aware of that.  disappointed,2026-03-13
amazon,Amazon Alexa / Echo,"the echo plus is great! so easy to set up and with the built in hub, it connects to other alexa devices with a mere verbal command. i am 62 and not super techno knowledgable but this was easy for me. have my lights integrated with alexa and now looking at security cameras and locks. definitely recommend the echo plus!",2026-03-02
amazon,Amazon Alexa / Echo,works as advertised! it says alexa is always learning. that's great because i am just learning all the things alexa can do.,2026-03-02
amazon,Amazon Alexa / Echo,wish it had a battery or was described better as a plug in only item.,2026-03-02
amazon,Amazon Alexa / Echo,doesn't seem to hear as well as my 2nd generation echo and why is there no volume buttons on it?!,2026-03-10
amazon,Amazon Alexa / Echo,worked great. the built in hub works great.,2026-03-14
amazon,Amazon Alexa / Echo,it knows everything  we ask it to do. havent smart hubbed it yet but does exactly as advertised and am very happy with our purchase. sound quality is excellent also,2026-03-14
amazon,Amazon Alexa / Echo,"connecting and sound are perfect! i only give 4 because the is no internal battery, if i disconnect to the power source, it will be off.",2026-03-01
amazon,Amazon Alexa / Echo,"it seems easy to stump alexa with rather simple questions that are easily googled with the correct answer.  we admit that we have not explored all that's available through the echo.  one irritating issue is that alexa cannot answer help questions concerning how to use the system, rather it refers you to the alexa app or help via a computer.  it was very simple to setup and use and we continue to learn how this tool can become more useful.",2026-03-05
amazon,Amazon Alexa / Echo,i like how easy it was to set up. very easy to use and set up with other bluetooth devices.,2026-03-08
amazon,Amazon Alexa / Echo,ease of use and many tasks it will perform,2026-03-14
amazon,Amazon Alexa / Echo,"i purchased the echo plus with built-in hub during prime days sale. it was delivered very fast and was easy to link to my wifi. also connected it to a smart plug to control a light. i love telling alexa to play music, and she hears me from 2 rooms away. excited to learn new uses for it.",2026-03-03
amazon,Amazon Alexa / Echo,"it was harder to setup then i thought it should be, for some reason i had to default  it twice. had to go thru too many steps to setup and find my devices. would be nice if it could interact with my xfinity cable tv cable box and it also does not work with my xfinity alarm for my house or my cameras, be nice set and disarm the alarm with alexa. had to install a skill app to setup bulb ??? whats that about, you ship it with your product ??? should have said (alexa setup bulb) or (alexa find new bulb) ??? and (alexa setup nest)??? it's fine that you use third party apps but alexa should do the work for you.",2026-03-09
amazon,Amazon Alexa / Echo,nothing to dislike i love my new toy that has made my house a smart home.,2026-03-05
amazon,Amazon Alexa / Echo,the built in hub lacks some of the features (geo fencing) of the phillips hub.  otherwise would have given it 5 stars.,2026-03-03
